Sheet: pthreads
A1: Кол-во потоков | B1: Время, мс | C1: Margin | D1: СКО | E1: Ускорение
A2: 1 | B2: 765.861 | C2: 0.444767 | D2: 2.26922 | E2: of:=[.B$2]/[.B2] -> 1
A3: 2 | B3: 508.677 | C3: 12.7847 | D3: 65.228 | E3: of:=[.B$2]/[.B3] -> 1.50559392305923
A4: 3 | B4: 382.237 | C4: 1.15906 | D4: 5.91355 | E4: of:=[.B$2]/[.B4] -> 2.00362863877647
A5: 4 | B5: 348.253 | C5: 0.537052 | D5: 2.74006 | E5: of:=[.B$2]/[.B5] -> 2.19915119180596
A6: 5 | B6: 331.019 | C6: 1.18012 | D6: 6.02102 | E6: of:=[.B$2]/[.B6] -> 2.3136466486818
A7: 6 | B7: 333.925 | C7: 1.63744 | D7: 8.35428 | E7: of:=[.B$2]/[.B7] -> 2.2935120161713
A8: 7 | B8: 338.159 | C8: 1.2661 | D8: 6.45969 | E8: of:=[.B$2]/[.B8] -> 2.26479555475383
A9: 8 | B9: 341.492 | C9: 2.25485 | D9: 11.5044 | E9: of:=[.B$2]/[.B9] -> 2.24269089759057